{
  "schema": 1,
  "scenarioId": "watch-claims-return-delivery",
  "subjectId": "watch-claims",
  "cacheProfile": "pinned-ads",
  "adsMode": "default",
  "bounds": {
    "keys": 1,
    "streams": 1,
    "generations": 2,
    "resources": 2,
    "queueCapacity": 1,
    "events": 128
  },
  "initialState": {
    "key": "key",
    "typ": "eds",
    "generation": 1,
    "phase": "waiting"
  },
  "events": [
    {
      "id": "e1",
      "actor": "publication",
      "kind": "publish-begin",
      "arguments": {
        "version": "",
        "names": [],
        "generation": 0
      },
      "happensAfter": []
    },
    {
      "id": "e2",
      "actor": "publication",
      "kind": "install",
      "arguments": {
        "version": "2",
        "names": [
          "A",
          "B"
        ],
        "generation": 0
      },
      "happensAfter": [
        "e1"
      ]
    },
    {
      "id": "e3",
      "actor": "publication",
      "kind": "fanout",
      "arguments": {
        "version": "",
        "names": [],
        "generation": 0
      },
      "happensAfter": [
        "e2"
      ]
    },
    {
      "id": "e4",
      "actor": "retry",
      "kind": "expire",
      "arguments": {
        "version": "",
        "names": [],
        "generation": 0
      },
      "happensAfter": [
        "e3"
      ]
    },
    {
      "id": "e5",
      "actor": "retry",
      "kind": "retry-begin",
      "arguments": {
        "version": "",
        "names": [],
        "generation": 0
      },
      "happensAfter": [
        "e4"
      ]
    },
    {
      "id": "e6",
      "actor": "retry",
      "kind": "retry-read",
      "arguments": {
        "version": "",
        "names": [],
        "generation": 0
      },
      "happensAfter": [
        "e5"
      ]
    },
    {
      "id": "e7",
      "actor": "publication",
      "kind": "publish-begin",
      "arguments": {
        "version": "",
        "names": [],
        "generation": 0
      },
      "happensAfter": [
        "e6"
      ]
    },
    {
      "id": "e8",
      "actor": "publication",
      "kind": "install",
      "arguments": {
        "version": "1",
        "names": [
          "A"
        ],
        "generation": 0
      },
      "happensAfter": [
        "e7"
      ]
    },
    {
      "id": "e9",
      "actor": "publication",
      "kind": "fanout",
      "arguments": {
        "version": "",
        "names": [],
        "generation": 0
      },
      "happensAfter": [
        "e8"
      ]
    },
    {
      "id": "e10",
      "actor": "retry",
      "kind": "expire",
      "arguments": {
        "version": "",
        "names": [],
        "generation": 0
      },
      "happensAfter": [
        "e9"
      ]
    },
    {
      "id": "e11",
      "actor": "retry",
      "kind": "retry-begin",
      "arguments": {
        "version": "",
        "names": [],
        "generation": 0
      },
      "happensAfter": [
        "e10"
      ]
    },
    {
      "id": "e12",
      "actor": "retry",
      "kind": "retry-read",
      "arguments": {
        "version": "",
        "names": [],
        "generation": 0
      },
      "happensAfter": [
        "e11"
      ]
    },
    {
      "id": "e13",
      "actor": "retry",
      "kind": "retry-replace",
      "arguments": {
        "version": "",
        "names": [],
        "generation": 0
      },
      "happensAfter": [
        "e12"
      ]
    },
    {
      "id": "e14",
      "actor": "retry",
      "kind": "forward",
      "arguments": {
        "version": "",
        "names": [],
        "generation": 0
      },
      "happensAfter": [
        "e13"
      ]
    },
    {
      "id": "e15",
      "actor": "transport",
      "kind": "send",
      "arguments": {
        "version": "",
        "names": [],
        "generation": 0
      },
      "happensAfter": [
        "e14"
      ]
    }
  ],
  "expectations": [
    {
      "property": "request-accounting",
      "outcome": "holds",
      "witnessOperationIds": [
        "e15"
      ]
    }
  ]
}
