{
  "schema": 1,
  "scenarioId": "watch-parking-return",
  "subjectId": "watch-parking",
  "cacheProfile": "pinned-ads",
  "adsMode": "default",
  "bounds": {
    "keys": 1,
    "streams": 1,
    "generations": 2,
    "resources": 2,
    "queueCapacity": 1,
    "events": 128
  },
  "initialState": {
    "key": "key",
    "typ": "eds",
    "generation": 1,
    "phase": "waiting"
  },
  "events": [
    {
      "id": "e1",
      "actor": "publication",
      "kind": "publish-begin",
      "arguments": {
        "version": "",
        "names": [],
        "generation": 0
      },
      "happensAfter": []
    },
    {
      "id": "e2",
      "actor": "publication",
      "kind": "install",
      "arguments": {
        "version": "2",
        "names": [
          "A",
          "B"
        ],
        "generation": 0
      },
      "happensAfter": [
        "e1"
      ]
    },
    {
      "id": "e3",
      "actor": "publication",
      "kind": "fanout",
      "arguments": {
        "version": "",
        "names": [],
        "generation": 0
      },
      "happensAfter": [
        "e2"
      ]
    },
    {
      "id": "e4",
      "actor": "retry",
      "kind": "expire",
      "arguments": {
        "version": "",
        "names": [],
        "generation": 0
      },
      "happensAfter": [
        "e3"
      ]
    },
    {
      "id": "e5",
      "actor": "retry",
      "kind": "retry-begin",
      "arguments": {
        "version": "",
        "names": [],
        "generation": 0
      },
      "happensAfter": [
        "e4"
      ]
    },
    {
      "id": "e6",
      "actor": "retry",
      "kind": "retry-read",
      "arguments": {
        "version": "",
        "names": [],
        "generation": 0
      },
      "happensAfter": [
        "e5"
      ]
    },
    {
      "id": "e7",
      "actor": "publication",
      "kind": "publish-begin",
      "arguments": {
        "version": "",
        "names": [],
        "generation": 0
      },
      "happensAfter": [
        "e6"
      ]
    },
    {
      "id": "e8",
      "actor": "publication",
      "kind": "install",
      "arguments": {
        "version": "1",
        "names": [
          "A"
        ],
        "generation": 0
      },
      "happensAfter": [
        "e7"
      ]
    },
    {
      "id": "e9",
      "actor": "publication",
      "kind": "fanout",
      "arguments": {
        "version": "",
        "names": [],
        "generation": 0
      },
      "happensAfter": [
        "e8"
      ]
    }
  ],
  "expectations": [
    {
      "property": "retry-persistence",
      "outcome": "holds",
      "witnessOperationIds": [
        "e9"
      ]
    }
  ]
}
