{
  "schema": 1,
  "scenarioId": "ack-is-not-application",
  "subjectId": "watch-parking",
  "cacheProfile": "pinned-ads",
  "adsMode": "default",
  "bounds": {
    "keys": 1,
    "streams": 1,
    "generations": 2,
    "resources": 2,
    "queueCapacity": 1,
    "events": 128
  },
  "initialState": {
    "key": "key",
    "typ": "eds",
    "generation": 1,
    "phase": "waiting"
  },
  "events": [
    {
      "id": "e1",
      "actor": "retry",
      "kind": "expire",
      "arguments": {
        "version": "",
        "names": [],
        "generation": 0
      },
      "happensAfter": []
    },
    {
      "id": "e2",
      "actor": "retry",
      "kind": "retry-begin",
      "arguments": {
        "version": "",
        "names": [],
        "generation": 0
      },
      "happensAfter": [
        "e1"
      ]
    },
    {
      "id": "e3",
      "actor": "retry",
      "kind": "retry-read",
      "arguments": {
        "version": "",
        "names": [],
        "generation": 0
      },
      "happensAfter": [
        "e2"
      ]
    },
    {
      "id": "e4",
      "actor": "retry",
      "kind": "retry-replace",
      "arguments": {
        "version": "",
        "names": [],
        "generation": 0
      },
      "happensAfter": [
        "e3"
      ]
    },
    {
      "id": "e5",
      "actor": "retry",
      "kind": "forward",
      "arguments": {
        "version": "",
        "names": [],
        "generation": 0
      },
      "happensAfter": [
        "e4"
      ]
    },
    {
      "id": "e6",
      "actor": "transport",
      "kind": "send",
      "arguments": {
        "version": "",
        "names": [],
        "generation": 0
      },
      "happensAfter": [
        "e5"
      ]
    },
    {
      "id": "e7",
      "actor": "client",
      "kind": "ack",
      "arguments": {
        "version": "1",
        "names": [],
        "generation": 0
      },
      "happensAfter": [
        "e6"
      ]
    }
  ],
  "expectations": [
    {
      "property": "ack-means-application",
      "outcome": "violated",
      "witnessOperationIds": [
        "e7"
      ]
    }
  ]
}
