{
  "schema": 1,
  "scenarioId": "old-cancel-preserves-successor",
  "subjectId": "watch-parking",
  "cacheProfile": "pinned-ads",
  "adsMode": "default",
  "bounds": {
    "keys": 1,
    "streams": 1,
    "generations": 2,
    "resources": 2,
    "queueCapacity": 1,
    "events": 128
  },
  "initialState": {
    "key": "key",
    "typ": "eds",
    "generation": 1,
    "phase": "waiting"
  },
  "events": [
    {
      "id": "e1",
      "actor": "client",
      "kind": "reconnect",
      "arguments": {
        "version": "",
        "names": [],
        "generation": 2
      },
      "happensAfter": []
    },
    {
      "id": "e2",
      "actor": "client",
      "kind": "initial-read",
      "arguments": {
        "version": "",
        "names": [],
        "generation": 0
      },
      "happensAfter": [
        "e1"
      ]
    },
    {
      "id": "e3",
      "actor": "client",
      "kind": "initial-park",
      "arguments": {
        "version": "",
        "names": [],
        "generation": 0
      },
      "happensAfter": [
        "e2"
      ]
    },
    {
      "id": "e4",
      "actor": "client",
      "kind": "cancel",
      "arguments": {
        "version": "",
        "names": [],
        "generation": 1
      },
      "happensAfter": [
        "e3"
      ]
    }
  ],
  "expectations": [
    {
      "property": "generation-ownership",
      "outcome": "holds",
      "witnessOperationIds": [
        "e4"
      ]
    },
    {
      "property": "parked-watch-retained",
      "outcome": "holds",
      "witnessOperationIds": [
        "e4"
      ]
    }
  ]
}
